scene,seq,pair,dof,label text,label value,round idx,pred option,pred text,reason,question
office,seq-09,000634-000646,phi,rightward,16.077994,2,0,ask more questions,"Based on the information provided by VLM, I'm not confident enough to determine the main camera movement from the source image to the target image. Although the chair, computer desk, and computer monitor appear to be in the same relative positions and orientations between the two images, this information alone is not sufficient to determine the camera movement.

The VLM's description suggests that the chair's orientation and position have not changed significantly, and the relative positions of other objects in the room are consistent. However, this consistency could be due to a variety of camera movements, including no movement, leftward rotation, rightward rotation, or even a combination of these.

To gather more information and make a more accurate judgment, I would like to ask more questions. Here are my next questions:","Can you tell me more about the items scattered around the room, such as the papers and white box? Are they in the same positions or have they moved slightly? Are there any other objects in the room that could provide more clues about the camera movement?"
office,seq-09,000634-000646,phi,rightward,16.077994,3,0,ask more questions,"Based on the information provided by VLM, I'm still not confident enough to determine the main camera movement from the source image to the target image. Although the chair, desk, and computer monitor appear to be in the same relative positions and orientations between the two images, the VLM's description of the scattered papers and white box suggests that there may be some movement.

The VLM mentions that the papers appear to be in a similar position in both images, but the white box is not visible in the second image. This could be due to the camera moving slightly to the right or left, causing the papers to shift accordingly. However, without more information, it's difficult to determine the exact camera movement.

To gather more information and make a more accurate judgment, I would like to ask more questions. Here are my next questions:","Can you tell me more about the scattered papers in the room? Are they in the same state of disarray in both images, or has there been some change? Are there any other objects in the room that could provide more clues about the camera movement?"
office,seq-09,000634-000646,phi,rightward,16.077994,4,2,no movement,"Based on the information provided by VLM, I believe that the main camera movement from the source image to the target image is ""no movement"". The VLM's description of the scattered papers suggests that they are in a similar state of disarray in both images, with no significant change in their arrangement. Additionally, the chair, desk, and computer monitor are in the same relative positions and orientations in both images, which suggests that the camera did not move significantly.

The VLM also mentions that there are no other objects in the room that could provide additional clues about the camera movement, which further supports the conclusion that the camera did not move significantly. While the white box is not visible in the second image, this could be due to a variety of reasons, such as it being removed or moved to a different location, rather than the camera moving.

Given the lack of significant changes in the arrangement of the objects in the room and the absence of other clues, I believe that the most likely explanation is that the camera did not move significantly between the two images.",None
chess,seq-02,000690-000707,phi,rightward,15.004958,1,3,no movement,"My reason is that since the VLM has indicated that the chessboard and chess pieces are static objects and have not moved or changed position between the source and target images, it means that the camera has not moved or changed position either. The fact that the relative positions of the objects remain the same suggests that the camera has remained stationary, resulting in no movement between the source and target images.",None
redkitchen,seq-14,000691-000740,phi,leftward,41.752244,1,0,ask more questions,"Although VLM mentioned that there is no evidence of camera movement, I'm not convinced that there is no movement at all. The description states that the position and movement of the objects are consistent between the two images, but it doesn't explicitly rule out the possibility of a very subtle or minor movement. Additionally, VLM didn't mention anything about the camera's position or orientation, which could still be different between the two images. Therefore, I'd like to ask more questions to gather more information before making a conclusion.",Can you tell me more about the camera's position and orientation in both images? Are there any subtle changes in the background or the way the objects are framed that could indicate a minor camera movement?
redkitchen,seq-14,000691-000740,phi,leftward,41.752244,2,3,ask more questions,"The description provided by VLM suggests that the camera's position and orientation have changed between the two images. The camera appears to be looking down in the first image and up in the second image, which indicates a change in the camera's angle or elevation. Additionally, the objects on the counter are slightly blurred in the first image and more in focus in the second image, which suggests that the camera may have moved closer or farther away from the counter. While the overall framing of the objects on the counter remains consistent, the subtle changes in the camera's position and orientation are not immediately apparent. Therefore, I'd like to ask more questions to gather more information about the camera movement.",Can you tell me more about the specific changes in the camera's position or orientation between the two images? Are there any other visual cues or hints that could help determine the direction or magnitude of the camera movement?
redkitchen,seq-14,000691-000740,phi,leftward,41.752244,3,2,no movement,"The description provided by VLM suggests that the camera's angle or elevation has changed between the two images, with the camera looking down in the first image and up towards the ceiling in the second image. This indicates a change in the camera's position or orientation, but it is not a rotation. The description also mentions that the objects on the counter appear to be slightly blurred in the first image and more in focus in the second image, which suggests that the camera may have moved closer to the counter in the second image. This is consistent with a vertical movement, such as a translation up or down. Therefore, I conclude that the main camera movement from the source image to the target image is no movement, as the camera's movement is likely a translation up or down rather than a rotation.",None
stairs,seq-06,000375-000411,phi,leftward,15.298887,1,2,ask more questions,"Although the VLM mentioned that the steps and background are stationary, I'm not convinced that there is no camera movement. Since the steps are positioned in a straight line, ascending from the bottom to the top of the image, I'm curious to know if the camera's perspective has changed between the source and target images. For example, did the camera move closer or farther away from the steps, or did it change its angle of view? To gather more information, I'd like to ask VLM some additional questions to help me narrow down the possible camera movements.","Can you please describe the perspective or angle of view of the camera in the source and target images? Are the steps and background appearing to be closer or farther away from the camera, or is the angle of view the same in both images?"
stairs,seq-06,000375-000411,phi,leftward,15.298887,2,1,no movement,"Based on the information provided by VLM, I believe that there is no camera rotation or horizontal movement. The steps remain in a straight line, ascending from the bottom to the top, and the pattern on the floor remains consistent in their arrangement and orientation. The only change mentioned is the camera's distance from the steps, which has decreased in the target image. This suggests that the camera has moved vertically, possibly downward, to get a closer view of the steps. Since there is no mention of a change in the camera's angle or orientation, I conclude that the main camera movement is likely a vertical translation, with the camera moving closer to the steps.","No additional questions for now. I'm confident that the camera movement is primarily a vertical translation, and I'm ready to make a final judgment."
office,seq-09,000160-000193,phi,leftward,15.206562,1,3,no movement,"My reason is that according to VLM, all the prominent objects are in the same relative positions and orientations in both images, indicating no significant movement. This suggests that the camera movement is likely to be a translation or a combination of translations, but not a rotation. Since the camera movement is limited to only one of six directions (three translations and three rotations), I conclude that the camera did not move at all, i.e., no movement.",None
pumpkin,seq-03,000187-000198,phi,leftward,15.474354,1,3,ask more questions,"Based on the information provided by VLM, the blue sofa appears to be closer to the camera in the target image, which suggests that the camera has moved downward from the source image to the target image. However, the positioning of the objects also suggests that the camera has moved slightly to the right. While this could be due to a rightward rotation, it's not clear whether the rotation is significant enough to be the primary movement. Therefore, I would like to ask more questions to VLM to gather more information and narrow down the possible camera movements.",Can you describe the distance between the blue sofa and the kitchen counter in both the source image and the target image? Is there any notable change in this distance between the two images?
pumpkin,seq-03,000187-000198,phi,leftward,15.474354,2,2,no movement,"Based on the additional information provided by VLM, it is clear that the camera has moved slightly to the right and closer to the blue sofa in the target image compared to the source image. This suggests a rightward translation, which is consistent with the initial observation that the camera has moved slightly to the right. The fact that the overall layout and positioning of the objects remain relatively consistent between the two images also supports this conclusion. There is no indication of a significant rotation or leftward movement, so I conclude that the main camera movement from the source image to the target image is ""no movement"" (option 2).",None
pumpkin,seq-06,000456-000474,phi,leftward,15.089308,1,2,no movement,"My reason is that the VLM mentioned that the positioning of the objects remains consistent between the two images, indicating that there is no significant movement or change in the environment. Additionally, the relationship between the objects is also static, with the sofa positioned in the foreground and the cabinets in the background. This suggests that the camera did not move at all, as the objects and their relationships remain unchanged. Since the camera movement is limited to only one of the six directions (three translations and three rotations), I conclude that the most likely option is no movement.","Can you please provide more details about the blue sofa? Is it in the same position in both images, or is it slightly shifted or rotated? Are there any other objects near the sofa that could provide clues about the camera movement?"
pumpkin,seq-06,000922-000950,phi,leftward,15.582437,1,1,ask more questions,"Although the VLM provided information about the main objects and their positions in both images, I need more information to determine the main camera movement. The objects' positions don't provide enough clues to infer the camera movement. For example, the cabinets are positioned above the countertop, but this doesn't necessarily imply a rotation or translation movement. The sink and tiled backsplash are also positioned in a way that doesn't provide clear information about the camera movement. To gather more information, I'll ask additional questions to the VLM to help narrow down the possible camera movements.","Can you tell me if the red cabinets, black countertop, sink, and tiled backsplash are aligned in the same way in both images? Are there any changes in their relative positions or orientations?"
pumpkin,seq-06,000922-000950,phi,leftward,15.582437,2,0,no movement,"Based on the VLM's information, it seems that the objects in both images are aligned in the same way, with no noticeable changes in their relative positions or orientations. This suggests that there is no significant camera movement between the two images. The VLM explicitly stated that the objects appear to be in the same position and orientation, indicating that the camera movement is likely to be minimal or non-existent. Given this information, I conclude that the main camera movement is likely to be ""no movement"", with the camera remaining stationary between the two images.",None
pumpkin,seq-08,000966-000976,phi,leftward,15.033759,1,1,ask more questions,"Although the VLM mentioned that the kitchen cabinets and countertop are static objects, it doesn't necessarily mean that the camera didn't move. The fact that the same objects are present in both images suggests that the camera might have moved to capture the target image. However, without more information, I'm not confident in choosing one of the six possible camera movements.","Can you tell me more about the position of the kitchen cabinets and countertop in the source and target images? Are they in the same relative position, or has the camera moved closer or farther away from them? Are there any other details in the images that could help me infer the camera movement?"
pumpkin,seq-08,000966-000976,phi,leftward,15.033759,2,0,no movement,"Based on the information provided by VLM, I'm going to choose the option that the camera didn't move. The fact that the kitchen cabinets and countertop are positioned in a similar manner in both images suggests that they are static objects, and the relative positions of the cabinets and countertop appear to be consistent between the two images. This indicates that the camera may not have moved significantly. Additionally, there are no clear indicators of the camera moving closer or farther away from the objects, as the perspective and scale of the cabinets and countertop remain relatively unchanged. Without any significant changes in the scene or objects, it's reasonable to assume that the camera didn't move.

I don't think it's necessary to ask more questions at this point, as the information provided by VLM is sufficient to make an informed decision.",None
pumpkin,seq-01,000215-000255,phi,leftward,15.244855,1,1,ask more questions,"Although VLM provided information about the main objects and their positions in both images, I don't have enough information to determine the main camera movement yet. I'd like to ask more questions to gather more details about the changes in the objects' positions and the overall scene. Specifically, I'd like to know more about the relationships between the objects and the surrounding environment, such as the walls, floor, and any other features that might provide clues about the camera movement.","Can you tell me more about the surrounding environment in both images, VLM? Are there any notable changes in the walls, floor, or other features that might indicate the camera movement?"
pumpkin,seq-01,000215-000255,phi,leftward,15.244855,2,2,rightward,"Based on VLM's description, I believe the main camera movement is a rightward rotation. The appliances on the countertop have shifted to the left, which suggests that the camera has moved slightly to the right. Additionally, the lighting change from well-lit to slightly dimmer also implies a movement to the right, as if the camera is now positioned at a slightly different angle to the light source. The fact that the wall tiles and floor remain in the same position in both images indicates that the camera did not move significantly in the vertical or horizontal directions, further supporting the idea of a rightward rotation.","Can you tell me more about the exact movement of the appliances on the countertop, VLM? Did they move uniformly or was it a more subtle shift? Are there any other objects or features in the scene that might provide additional clues about the camera movement?"
redkitchen,seq-14,000740-000775,phi,leftward,16.612008,1,1,ask more questions,"The information provided by VLM suggests that the microwave, phone, and wooden box have consistent positions and arrangements between the source and target images. This implies that the camera movement is not a translation (i.e., moving left or right, up or down) because the objects' positions are identical. The consistent positioning of the objects also rules out any significant rotation, as the objects would likely appear distorted or differently aligned if there was a significant rotation. Therefore, I'm not confident in choosing options 0, 2, or 3, and I'd like to ask more questions to gather additional information.","Can you tell me more about the background or surrounding environment in both images? Are there any notable features, such as a wall, floor, or other objects, that could provide clues about the camera movement?"
redkitchen,seq-14,000740-000775,phi,leftward,16.612008,2,3,no movement,"The information provided by VLM suggests that the camera movement is likely limited to a small range of motion, such as a slight tilt or a minor shift in perspective, rather than a full rotation or translation. The consistency in the positioning and arrangement of the objects, as well as the stationary background, indicates that the camera movement is minimal. The fact that the objects are arranged in a way that suggests they are stationary and not in motion further supports the idea that there is no significant movement. Given these details, I believe that the most likely option is that there is no movement (option 3) from the source image to the target image.",None
office,seq-09,000646-000656,phi,rightward,16.602234,1,1,rightward,"My reason is that the chair is positioned in the center of the image, facing towards the right side of the frame, and the desk is located to the left of the chair. This suggests that the camera is initially facing the right side of the chair. Since the chair appears to be in a similar position in both images, and the computer monitor is situated on the desk, slightly to the right of the center of the desk, it implies that the camera has rotated around the chair to face the left side of the chair in the target image. This movement can be described as a rightward rotation.",None
office,seq-10,000038-000059,phi,rightward,15.373692,1,1,ask more questions,"Although the VLM provided information about the consistent layout of the room, the positioning of the furniture, and the absence of people, I still need more information to determine the main camera movement. The fact that the lighting and color tones are consistent between the two images suggests that the camera did not move to a different location or change its orientation significantly. However, I would like to ask more questions to clarify the movement of the camera.",Can you tell me if there are any changes in the depth of field or the focus of the camera between the two images? Are there any objects that appear closer or farther away in the target image compared to the source image?
office,seq-10,000038-000059,phi,rightward,15.373692,2,1,no movement,"Based on the information provided by VLM, I believe that the main camera movement from the source image to the target image is no movement. The VLM mentioned that the consistent lighting and color tones suggest that the camera did not move to a different location or change its orientation significantly. Additionally, the depth of field and focus of the camera appear to be consistent between the two images, with no noticeable changes in the clarity or sharpness of the objects in the room.

The only changes observed are slight rearrangements of the desk and computer setup, which could be due to a slight movement of the camera, but not enough to change the overall orientation or position of the camera. The VLM did not mention any significant changes in the position of the chair, desk, or bookshelf, which suggests that the camera did not move significantly.

I do not think that the camera moved leftward or rightward rotation, as there is no evidence of a significant change in the position of the objects in the room. Therefore, I choose the option ""no movement"" as the main camera movement from the source image to the target image.",None
pumpkin,seq-03,000198-000207,phi,leftward,15.906826,1,3,ask more questions,"Although the VLM mentioned that the sofa is stationary in both images, and the kitchen area has some movement, I'm not confident that I can determine the main camera movement solely based on this information. The description of the movement of the kitchen area is quite subtle, and it's not clear what type of movement is occurring (e.g., rotation, translation, or a combination of both). Additionally, the relationship between the sofa and the kitchen area is that the sofa is in the foreground and the kitchen area is in the background, which doesn't provide much information about the camera movement.

To gather more information, I'd like to ask some additional questions to VLM. Here are my questions:","Can you describe the position of the blue sofa in more detail? Is it centered in the image, or is it slightly off-center? Are there any other objects in the foreground that could provide more context about the camera movement?"
pumpkin,seq-03,000198-000207,phi,leftward,15.906826,2,2,ask more questions,"Based on the new information provided by VLM, I'm not yet confident that I can determine the main camera movement solely based on the positions and movements of the objects in the images. Although the sofa is centered in the foreground and the kitchen area seems to have some movement, the lack of clear information about the type of movement and the combination of translation and rotation possibilities makes it difficult to pinpoint the exact camera movement.

I'd like to ask some additional questions to VLM to gather more information and narrow down the possibilities. Here are my questions:",Can you provide more information about the movement of the objects on the countertop and cabinets in the kitchen area? Are they moving in a specific pattern or direction? Are there any objects that are not moving at all?
pumpkin,seq-03,000198-000207,phi,leftward,15.906826,3,1,ask more questions,"Based on the new information provided by VLM, I'm still not confident that I can determine the main camera movement solely based on the positions and movements of the objects in the images. Although the kitchen area appears to have some movement, the lack of clear information about the specific pattern or direction of the movement makes it difficult to pinpoint the exact camera movement.

I'd like to ask some additional questions to VLM to gather more information and narrow down the possibilities. Here are my questions:","Can you provide more information about the specific objects that are slightly out of place or displaced in the kitchen area? Are they all in the same direction or pattern, or are they scattered randomly?"
pumpkin,seq-03,000198-000207,phi,leftward,15.906826,4,2,rightward,"Based on the new information provided by VLM, I'm going to take a guess that the main camera movement is a rightward rotation. The objects in the kitchen area that are slightly out of place or displaced are all moving in a rightward direction, with the bottle and bowl moving to the right, and the spoon moving to the left. This suggests that the camera may have rotated to the right, causing these objects to appear displaced.

I'm making this guess because the objects are not moving in a uniform pattern, but rather seem to be scattered randomly. This could be due to the camera movement causing the objects to appear displaced, rather than any intentional movement of the objects themselves. Additionally, the fact that the objects are all moving in a rightward direction suggests that the camera movement may be a rotation rather than a translation.

I'd like to ask one more question to VLM to confirm my guess:","Can you provide more information about the relationship between the sofa and the kitchen area in more detail? Is the sofa stationary relative to the kitchen area, or is it moving in relation to it?"
redkitchen,seq-01,000140-000168,phi,rightward,15.48627,1,3,ask more questions,"Although the VLM mentioned that the overall layout of the kitchen remains consistent, the objects on the countertop may have been moved or rearranged. This suggests that the camera movement could be a rotation, as it would allow for the objects on the countertop to be rearranged without changing the overall layout of the kitchen. However, without more information, I'm not confident enough to pinpoint the exact rotation direction (leftward or rightward). I'd like to ask more questions to gather more details before making a final judgment.","Can you tell me more about the microwave and the toaster? Are they in the same position in both images, or have they been moved or rotated? Are there any other objects on the countertop that could provide clues about the camera movement?"
