scene,seq,pair,dof,label text,label value,round idx,pred option,pred text,reason,question
pumpkin,seq-03,000265-000285,phi,rightward,20.616599,1,2,ask more questions,"Although the VLM mentioned that the relative positions of the objects remain consistent between the two images, it doesn't provide information about the camera's position or orientation. Since the objects are stationary, it's possible that the camera moved to capture the target image, but we don't have enough information to determine the direction of movement. Therefore, I'd like to ask more questions to gather more information.",Can you tell me more about the background in both images? Is it the same or has it changed? Are there any other objects in the scene that could provide clues about the camera movement?
pumpkin,seq-03,000265-000285,phi,rightward,20.616599,2,3,rightward,"The VLM's description suggests that the camera moved closer to the soda machine, which implies a translation movement. Additionally, the fact that the perspective of the surrounding objects remains the same indicates that the camera did not move significantly in the vertical direction. The combination of a slight translation and rotation is consistent with a rightward rotation, as the camera moved closer to the soda machine while maintaining the same perspective of the surrounding objects.",Can you provide more information about the extent of the rotation? Was it a small or significant change in the camera's orientation?
pumpkin,seq-06,000950-000983,phi,leftward,15.19751,1,1,ask more questions,"Although VLM mentioned that the position and relationship of objects remain consistent between the two images, it's possible that the camera movement is not just a simple translation or rotation. Since the main objects are the same and their positions are consistent, it's likely that the camera movement is a combination of translation and rotation. Therefore, I'd like to ask more questions to gather more information before making a final judgment.","Can you tell me more about the orientation of the objects in the target image compared to the source image? For example, is the blue couch in the same position relative to the red cabinets in both images? Are the objects aligned with the same grid or pattern in both images?"
pumpkin,seq-06,000950-000983,phi,leftward,15.19751,2,3,rightward,"Based on VLM's description, I believe the main camera movement from the source image to the target image is a rightward rotation. The blue couch remains in a similar position relative to the red cabinets, indicating that the couch has not moved significantly. The red cabinets, however, seem to have a slight shift in their position, suggesting a possible rotation or translation. The fact that the objects are aligned with a grid pattern on the wall, which remains consistent, suggests that the camera movement might involve a rotation around the grid pattern. Since the couch is not moved significantly, it's likely that the rotation is around the vertical axis (i.e., a rightward rotation). The placement of the white trash bin and the sink in the source image is consistent with their placement in the target image, which further supports the idea of a rightward rotation.","Can you tell me more about the extent of the rotation? Is it a small, subtle rotation or a more significant one? Are there any other visual cues that could help confirm the direction and extent of the rotation?"
redkitchen,seq-04,000334-000362,phi,rightward,15.427867,1,2,ask more questions,"After analyzing the information provided by VLM, I'm not confident enough to determine the main camera movement from the source image to the target image based on the object positions and movements. Although the objects have a slight shift in their positions, it's not clear whether the camera moved in a specific direction or not. I'd like to ask more questions to gather more information and narrow down the possible camera movements.","Can you provide more details about the direction and extent of the slight shift in the positions of the objects from the source to the target image? For example, are the objects shifted horizontally, vertically, or diagonally? Are the shifts consistent across all objects, or are some objects shifted more than others?"
redkitchen,seq-04,000334-000362,phi,rightward,15.427867,2,2,rightward,"Based on the information provided by VLM, I believe the main camera movement from the source image to the target image is a rightward rotation. The objects in the target image have shifted slightly to the right, with each object moving in a similar manner. The sign ""BEING HUMAN"" has moved from the left side of the red counter to a position closer to the center, the stethoscope has moved from the left side of the sign to the right side, and the red counter itself has shifted to the right while maintaining its alignment with the wall. This suggests a horizontal movement to the right, which is consistent with a rightward rotation of the camera.

I'm confident in my judgment, as the shifts in the positions of the objects are consistent across all objects and suggest a uniform movement to the right. Therefore, I don't need to ask any more questions to VLM at this point.",None
stairs,seq-04,000151-000179,phi,leftward,15.41564,1,3,ask more questions,"Although the staircase and railing are in the same position in both images, the fact that they are the only common objects suggests that the camera movement is not a translation (left, right, forward, or backward) because the entire scene has shifted. The railing being on the left side in both images implies that the camera has not moved laterally. The staircase being in the center in both images implies that the camera has not moved vertically. Given these constraints, I believe that the camera movement is more likely to be a rotation. However, without more information, I cannot determine the direction of the rotation (leftward or rightward). Therefore, I choose to ask more questions to gather more information.","Can you tell me if there are any other features in the images that could help determine the direction of the rotation, such as the position of the stairs in relation to the railing or any other distinctive patterns or shapes in the images?"
stairs,seq-04,000151-000179,phi,leftward,15.41564,2,2,leftward,"Based on the information provided by VLM, I believe that the camera movement is a rotation. The consistency in the position of the staircase and railing suggests that the camera has not moved laterally or vertically. The fact that the staircase is aligned with the railing in both images implies that the camera has rotated around the railing. Since the staircase is centered in the middle of the frame, I believe that the camera has rotated around the railing in a counterclockwise direction (leftward rotation). This is because the staircase would need to be aligned with the railing in the target image, which would require a leftward rotation to achieve.",None
office,seq-03,000697-000712,phi,leftward,18.685102,1,2,ask more questions,"Although VLM mentioned that the camera movement appears to be a right translation, I want to confirm this information by asking more questions. The description provided by VLM only mentions the movement of the chair and desk, but not the computer monitor, pair of shoes, or piece of paper. By asking more questions, I can gather more information about the movement of these objects and confirm or contradict VLM's initial assessment.","Can you please provide more information about the movement of the computer monitor, pair of shoes, and piece of paper from the source image to the target image? Are there any specific details about their positions or orientations that might help me determine the main camera movement?"
office,seq-03,000697-000712,phi,leftward,18.685102,2,1,rightward,"Based on the new information provided by VLM, I am convinced that the main camera movement is a rightward translation. The computer monitor has moved from the left side of the desk to the right side, and the piece of paper has moved from the right side of the desk to the left side. The pair of shoes remains in the same position, which suggests that the camera movement is indeed a translation and not a rotation. The fact that the screen of the computer monitor is facing away from the viewer in the target image also supports the idea of a rightward translation, as the camera would need to move to the right to capture the monitor from a different angle.",None
office,seq-09,000766-000780,phi,leftward,16.300114,1,2,no movement,"My reason is that since the main objects (desk, chair, computer, monitor, and window) are positioned similarly in both the source image and the target image, it suggests that the camera has not moved at all. The VLM's description mentions that the desk and chair are positioned in a similar manner in both images, and the computer and monitor are located on the desk in both images. Additionally, the window is visible in the background of both images, which implies that the camera has not changed its position or orientation. Therefore, I conclude that there is no movement from the source image to the target image.",None
chess,seq-02,000055-000082,phi,leftward,15.033127,1,1,ask more questions,"Although the VLM mentioned that the chairs are in the same position in both images, suggesting no significant movement or change in the camera's position or angle, I'm not entirely convinced that the camera didn't move at all. The fact that the chairs are arranged in a semi-circle around the chessboard implies that the camera was positioned in a way that allows it to capture this arrangement. However, the VLM didn't provide information about the camera's position or angle, so I'm not sure if it's possible to rule out any camera movement.

I'd like to ask more questions to clarify the situation. Can you tell me if the chessboard is in the same position in both images, or is it slightly shifted or rotated? Are there any other objects or features in the room that could provide clues about the camera's movement?",None
chess,seq-02,000055-000082,phi,leftward,15.033127,2,1,no movement,"Based on the VLM's information, the chessboard, chess pieces, and chairs are all in the same position and arrangement in both images. Additionally, the camera angle and position appear to be consistent between the two images, with no significant movement or change. Given that there are no other objects or features in the room that could provide clues about the camera's movement, I believe that the camera did not move at all from the source image to the target image. The lack of any changes in the arrangement of the objects or the camera's position/angle suggests that the camera remained stationary.",None
office,seq-08,000710-000724,phi,rightward,17.975933,1,0,ask more questions,"Based on the information provided by VLM, I'm not confident enough to determine the main camera movement from the source image to the target image. Although the objects are relatively static, I'd like to gather more information to rule out other possibilities.

I'd like to ask VLM a few more questions to help me narrow down the options. Here are my questions:","Can you tell me more about the position of the window with blinds in both images? Is it in the same location, or has it moved slightly? Are the blinds open or closed in both images?"
office,seq-08,000710-000724,phi,rightward,17.975933,2,3,rightward,"The information provided by VLM suggests that the window with blinds has moved slightly to the right in the target image compared to the source image. This implies that the camera has moved to the right as well. Since the blinds are still closed, it's unlikely that the camera has moved left or rotated in any direction. The fact that the chair, desk, and computer setup are still in the same position suggests that the camera movement is not a translation, but rather a rotation.

Given that the window has moved to the right, I'm going to take a chance and conclude that the main camera movement from the source image to the target image is a rightward rotation. However, I'd like to ask one more question to confirm my hypothesis:",Can you tell me if the bookshelf or any other objects in the room have changed their positions or orientations in the target image compared to the source image?
office,seq-04,000691-000717,phi,rightward,15.378286,1,2,ask more questions,"Although the VLM mentioned that the main objects and their positions remain the same in both images, I'm not convinced that there is no significant movement or change in their positions. The fact that the mannequins are positioned on the desk in the same relative positions in both images suggests that the camera movement might be related to the mannequins. Since the camera movement is limited to only six directions, I'd like to ask more questions to gather more information before making a final judgment.","Can you please tell me if there are any subtle changes in the mannequins' poses or postures between the source and target images? Are there any slight movements or changes in the way they are positioned on the desk? Are there any other objects in the images that might be affected by the camera movement, such as shadows or reflections?"
office,seq-04,000691-000717,phi,rightward,15.378286,2,1,no movement,"The VLM's description suggests that the mannequins' poses have changed between the source and target images, with the mannequin on the left leaning backward and the one on the right turned to the left. However, the desk, room, and other objects remain in the same position. This lack of movement in the surrounding environment and objects, combined with the subtle changes in the mannequins' poses, suggests that the camera movement is likely to be a rotation rather than a translation. Since the camera movement is limited to only six directions, and the mannequins' poses suggest a rotation, I believe the main camera movement from the source image to the target image is likely to be no movement.

However, I'd like to ask a few more questions to confirm my hypothesis:",Can you please confirm if the window in the background remains in the same position and orientation in both images? Are there any other subtle changes in the scene that might be indicative of a rotation or other camera movement?
redkitchen,seq-12,000294-000317,phi,rightward,16.646788,1,2,no movement,"My reason is that based on the information provided by VLM, there is no significant movement or camera movement between the source and target images. The objects, including the red cabinets, black countertop, and items on the countertop, appear to be stationary and remain in the same position and relationship to each other. This suggests that the camera did not move at all, or at least did not move in a way that would affect the position or arrangement of the objects in the images.",Can you please tell me more about the items on the countertop? Are they arranged in a specific pattern or are they scattered randomly? Are there any specific items that are more prominent or attention-grabbing than others?
office,seq-08,000267-000284,phi,leftward,15.348399,1,1,no movement,"My reason is that the VLM's description suggests that the office chair, computer desk, monitor, and keyboard are in similar positions in both images, indicating that there has been little to no movement of the camera. The carpeted floor is also visible in both images, with the chair and desk positioned on it, which further supports the idea that the camera has remained relatively stationary. The only hint of movement mentioned is that the chair is facing towards the right side of the frame, but this could be due to the chair's design or the scene's setup rather than camera movement. Overall, the lack of significant object movement and the consistent scene layout suggest that the camera has not moved significantly.",None
office,seq-07,000236-000279,phi,leftward,27.607591,1,0,ask more questions,"Based on the information provided by VLM, I think it's necessary to ask more questions to narrow down the possible camera movements. Although VLM mentioned that the positioning of the objects suggests a combination of left translation and right rotation, I'd like to gather more information to make a more accurate judgment.

For example, I'd like to know the following:

* Are the people, desks, chairs, computers, and papers arranged in a symmetrical or asymmetrical pattern in both images?
* Are there any objects that have changed positions between the two images, such as papers being moved from one desk to another?
* Are there any objects that are partially occluded or have changed orientation between the two images?

By asking these questions, I hope to gather more specific information about the camera movement and make a more informed decision about the main camera movement from the source image to the target image.",None
office,seq-07,000236-000279,phi,leftward,27.607591,2,0,rightward,"Although VLM's description suggests that the main camera movement involves a right rotation of the computer monitor, I'm not entirely convinced. The description mentions that the desk, chair, and poster on the wall remain in the same position, which suggests that the camera movement might be more complex than just a simple rotation.

I'd like to ask VLM some follow-up questions to clarify the situation:","Can you confirm that the desk, chair, and poster on the wall are indeed in the same position in both images? Are there any other objects in the room that have changed position or orientation between the two images?

Additionally, I'd like to know more about the window and the natural light entering the room. Is the window still facing the same direction in both images? Are there any changes in the way the light is illuminating the room?

By asking these questions, I hope to gather more information about the camera movement and make a more informed decision about the main camera movement from the source image to the target image."
redkitchen,seq-12,000821-000833,phi,leftward,15.780138,1,0,ask more questions,"Based on the information provided by VLM, I believe that asking more questions is the best option at this point. Although the VLM has given us some valuable insights, I'd like to gather more information about the specific positions of the objects, particularly the red cabinets and the wooden table, to better understand the camera movement.

Additionally, the VLM mentioned that the relationship between the cabinets and the table suggests a possible translation or rotation, but I'd like to know more about the exact distances and angles involved. By asking more questions, I can get a better sense of the spatial relationships between the objects and the camera movement.

Here are some additional questions I'd like to ask VLM:","Can you please provide more details about the position of the cabinets in both images? Are they aligned with the wall, or is there a slight offset? Are they at the same distance from the camera in both images?"
redkitchen,seq-12,000821-000833,phi,leftward,15.780138,2,3,rightward,"Based on the information provided by VLM, I believe that the main camera movement from the source image to the target image is a rightward rotation. The VLM mentioned that the red cabinets are aligned with the wall in the second image, which suggests that the camera has moved to the right to bring the cabinets into alignment with the wall. Additionally, the VLM stated that there is a slight offset in the position of the cabinets between the two images, which also supports the idea of a rightward rotation.

The fact that the wooden table is present in both images and its position appears to be consistent between the two images suggests that the camera movement is not a translation, as the distance and angle of the camera relative to the objects do not appear to have changed significantly. The VLM also mentioned that the camera movement is likely limited to a translation or rotation, which further supports the idea of a rightward rotation.

I do not believe that the camera movement is a leftward rotation, as the VLM mentioned that the cabinets are positioned slightly to the left of the wall in the first image, which would not be consistent with a leftward rotation.

I do not believe that there is no movement, as the VLM mentioned that there is a slight offset in the position of the cabinets between the two images, which suggests that the camera has moved to some extent.

Therefore, I choose option 3, rightward rotation, as the most likely camera movement from the source image to the target image.",None
office,seq-07,000145-000189,phi,leftward,21.816486,1,0,ask more questions,"Although the VLM mentioned that the camera movement is likely limited to a rotation or a slight translation, I would like to ask more questions to gather more information before making a judgment. The fact that the relative positions of the objects remain consistent between the two images suggests that the camera movement is subtle, but I would like to know more about the specific details of the object positions and any potential changes in their appearance.","Can you tell me more about the position of the chair in relation to the desk? Is it exactly in front of the desk, or is it slightly offset to one side? Additionally, are the objects on the desk, such as papers or objects, in the same position or arrangement in both images?"
office,seq-07,000145-000189,phi,leftward,21.816486,2,2,leftward,"Based on the information provided by VLM, I believe the main camera movement from the source image to the target image is a leftward rotation. The fact that the chair remains in the same position in front of the desk and the objects on the desk appear to be in the same arrangement suggests that the camera did not translate or move significantly. The consistency in the relative positions of the objects, including the chair and the bookshelf, implies that the camera movement is likely a rotation. Given that the chair is positioned directly in front of the desk, a leftward rotation would be more plausible than a rightward rotation, as it would allow the chair to remain in the same position while the camera rotates.",None
office,seq-10,000197-000226,phi,leftward,15.476087,1,0,ask more questions,"Although VLM has provided some information about the objects in both images, I'm not entirely convinced that the camera movement is a left translation. The description of the objects' positions and movements suggests that the camera might have moved in a more complex way. For example, the chairs facing the viewer in both images could indicate that the camera didn't move significantly in the vertical direction. Additionally, the fact that the monitors facing the viewer in both images haven't changed suggests that the camera might not have rotated significantly.

To gather more information, I'd like to ask VLM some follow-up questions to better understand the camera movement. Here are my questions:","Can you tell me more about the relationship between the desks and the office chairs in both images? Are they at the same distance from the camera, or has the camera moved closer or farther away from them?"
office,seq-10,000197-000226,phi,leftward,15.476087,2,3,leftward,"Based on the information provided by VLM, I believe the main camera movement from the source image to the target image is a leftward rotation. The fact that the desk and office chairs remain in the same relative positions, with the monitors on the desk facing the viewer, suggests that the camera has moved in a way that has not changed the overall layout of the room. The description of the objects' positions and movements also implies that the camera has not moved significantly in the vertical direction, which is consistent with a leftward rotation.

The only movement that could explain the consistent layout and object positions is a leftward translation, as VLM initially suggested. The fact that the camera has likely moved closer to the desk, resulting in a more detailed view of the objects, also supports this conclusion. There is no evidence to suggest that the camera has moved in a rightward direction, and the description of the objects' positions and movements does not indicate any significant change in the camera's orientation or perspective.

Therefore, I do not think it is necessary to ask more questions at this point, and I am confident that the main camera movement is a leftward rotation.",None
office,seq-09,000634-000646,phi,rightward,16.077994,1,1,ask more questions,"Based on the information provided by VLM, I'm not confident enough to determine the main camera movement from the source image to the target image. Although the positions and orientations of the chair, computer desk, and computer monitor appear to be consistent between the two images, this information alone is not sufficient to determine the camera movement.

I would like to ask more questions to gather more information about the images. Here are my next questions:",Can you tell me more about the orientation of the chair in the source and target images? Is it facing the same direction or has it changed? Are there any other objects in the room that could provide more clues about the camera movement?
