scene,seq,pair,dof,label text,label value,round idx,pred option,pred text,reason,question
redkitchen,seq-01,000140-000168,phi,rightward,15.48627,2,1,rightward,"The VLM's description of the microwave and toaster's positions in both images suggests that the camera has rotated to the right. In the source image, the microwave is to the left of the toaster, and in the target image, it's to the right. This change in position can only be explained by a rightward rotation of the camera, which would allow the objects on the countertop to be rearranged without changing the overall layout of the kitchen. The fact that the microwave's height relative to the toaster remains the same in both images further supports this conclusion.",None
office,seq-08,000091-000101,phi,rightward,16.095312,1,2,rightward,"My reason is that the VLM mentioned that the desk, chair, carpeted floor, and wall with the window appear to be in the same position in both images, which suggests that the camera movement is a rotation around the desk. Since the desk and chair are positioned in the same relative location in both images, I infer that the rotation is likely to be a rightward rotation, as the chair would move to the right of the desk if the camera rotates to the right.","Can you tell me more about the orientation of the shelf with various items on it in both images? Is it facing the same direction in both images, or has it changed orientation?"
office,seq-09,000438-000457,phi,rightward,17.077953,1,1,ask more questions,"Based on the information provided, the main objects remain in the same positions in both images, which suggests that the camera movement is not a significant change. However, I'm not confident enough to conclude that there is no movement or a specific type of rotation without gathering more information. The description mentions the objects' positions relative to each other, but it doesn't provide information about their absolute positions or the camera's orientation. I'd like to ask more questions to gather more details before making a judgment.",Can you tell me more about the position of the chair in the target image? Has it moved or changed orientation? Is it still facing the monitor?
office,seq-09,000438-000457,phi,rightward,17.077953,2,3,no movement,"The information provided suggests that the chair, which is facing the monitor, has maintained its original orientation and position in the target image. This implies that the camera movement is not affecting the objects' orientations or positions relative to each other. The fact that the chair is still facing the monitor and its position is unchanged suggests that the camera movement is likely to be a translation, rather than a rotation. Since the chair is facing the monitor, it's unlikely that the camera has rotated leftward or rightward. Therefore, I conclude that the camera movement is likely to be no movement or a translation.",Can you tell me more about the position of the desk lamp in the target image? Has it moved or changed orientation compared to the source image?
office,seq-03,000775-000800,phi,leftward,15.36707,1,1,ask more questions,"Based on the information provided by VLM, I don't have enough evidence to determine the main camera movement from the source image to the target image. The people and office furniture appear to be stationary, which suggests that the camera movement might be a rotation or translation. However, without more information, I cannot confidently choose one of the six possible camera movements (three translations and three rotations). Therefore, I would like to ask more questions to gather more information.","Can you please tell me, VLM, if there are any visual cues that suggest the camera has moved, such as changes in the lighting, shadows, or texture of the objects? Are there any objects in the scene that could be used as a reference point to determine the camera movement?"
office,seq-03,000775-000800,phi,leftward,15.36707,2,2,no movement,"Based on the information provided by VLM, I conclude that the main camera movement from the source image to the target image is ""no movement"". The VLM mentioned that there are no significant changes in lighting, shadows, or texture of objects that would suggest a specific camera movement, and that the position of the objects, such as the desk, chairs, and backpack, appear to be consistent between the two images. Additionally, the window and the wall also maintain their positions, indicating that there is no noticeable rotation or translation of the camera. Given these observations, it seems that the camera did not move at all from the source image to the target image.",None
pumpkin,seq-03,000162-000187,phi,leftward,15.021268,1,1,ask more questions,"Although VLM's description suggests that the camera movement is likely a left translation, I'm not entirely convinced. The positioning and arrangement of the objects seem to match, but I'd like to gather more information to confirm the movement. For example, I'd like to know if the blue sofa, sink, and coffee machine are in the same relative positions in both images, or if they've shifted slightly. Additionally, I'd like to know if the red cabinets above the countertop are perfectly aligned or if there's a slight difference in their positions. By asking more questions, I can gather more precise information to make a more informed decision about the camera movement.","Can you tell me if the blue sofa, sink, and coffee machine are in the same relative positions in both images? Are the red cabinets above the countertop perfectly aligned or is there a slight difference in their positions?"
pumpkin,seq-03,000162-000187,phi,leftward,15.021268,2,2,ask more questions,"Based on VLM's description, the blue sofa remains in the same relative position, which suggests that the camera movement is not a rotation. The sink and coffee machine have shifted slightly, which indicates that the camera movement is not a pure translation. The fact that the sink has moved slightly to the right and the coffee machine has moved slightly to the left suggests that the camera movement is a combination of translation and rotation. However, I'm not convinced that the movement is a rotation, as the red cabinets above the countertop appear to be perfectly aligned in both images. To further clarify the camera movement, I'd like to ask more questions.","Can you tell me if the camera movement is a combination of translation and rotation, or is it primarily one or the other? Are there any other objects in the scene that have shifted or moved during the camera movement?"
pumpkin,seq-03,000162-000187,phi,leftward,15.021268,3,0,leftward,"Based on VLM's description, the blue sofa remains in the same relative position, which rules out rotation. The sink and coffee machine have shifted slightly, indicating that the camera movement is not a pure translation. The combination of translation and rotation is further supported by the fact that the sink has moved slightly to the right and the coffee machine has moved slightly to the left. Given this information, I believe that the main camera movement is a leftward rotation, as the sink has moved in the direction of rotation and the coffee machine has moved in the opposite direction.",None
pumpkin,seq-01,000644-000663,phi,rightward,15.347003,1,0,ask more questions,"Based on the information provided by VLM, I don't have enough evidence to determine the main camera movement from the source image to the target image. Although the objects mentioned are present in both images, there is no information about their relative positions or movements. For example, are the red cabinets, black countertop, sink, and tiled backsplash in the same positions in both images, or have they moved? Are there any other objects that could provide clues about the camera movement? To gather more information, I'd like to ask more questions to VLM.","Can you please describe the position of the sink in the source image compared to the target image? Is it in the same location, or has it moved? Are there any other objects that have changed positions between the two images?"
pumpkin,seq-01,000644-000663,phi,rightward,15.347003,2,1,no movement,"The information provided by VLM suggests that the sink has not moved significantly between the source and target images, and its relative positions to the red cabinets and black countertop remain consistent. This implies that the camera has not moved in translation (left, right, forward, or backward) and has not rotated significantly. The only remaining possibilities are a small rotation or no movement at all. Since there is no indication of a significant rotation, I conclude that the main camera movement from the source image to the target image is likely ""no movement"" (option 1).",None
office,seq-08,000408-000423,phi,rightward,15.434366,1,0,no movement,"The main objects in both images, such as the desk, chair, computer monitor, window, and backpack, are in the same relative positions and arrangements. This suggests that the camera has not moved at all between the source and target images, as the objects are not displaced or rearranged. The fact that the objects are in the same positions and arrangements implies that the camera's viewpoint has not changed, and the camera has remained stationary.",None
office,seq-09,000738-000746,phi,rightward,17.407764,1,1,rightward,"The main camera movement from the source image to the target image is likely a rightward rotation. This is because the desk and chair are now on opposite sides of the image compared to the source image, which suggests that the camera has moved to the right. The VLM's description states that the chair and desk are in similar positions in both images, with the desk being to the left of the chair and the computer monitor on the desk. This implies that the objects themselves have not moved, but rather the camera has rotated to capture the scene from a different angle. The rightward rotation is the most likely explanation for the change in the objects' positions in the image.","VLM, can you please describe the orientation of the chair and desk in more detail? Are they facing the same direction in both images, or has the chair rotated as well?"
office,seq-08,000423-000440,phi,rightward,15.676126,1,1,ask more questions,"Although VLM has provided a detailed description of the objects and their positions in both images, I'm not entirely convinced that the camera hasn't moved at all. The information provided suggests that the desks and monitors are in the same relative positions in both images, which implies that the camera hasn't moved in a way that would affect the positioning of these objects. However, I'm still unsure about the possibility of a rotation or a very small translation that might not have affected the objects' positions.

To further clarify the situation, I'd like to ask VLM some additional questions to rule out any other possibilities. Here are my questions:","Can VLM provide more information about the background, such as any subtle changes in the lighting or shadows that might indicate a slight movement of the camera? Are there any other objects in the background that could provide clues about the camera movement?

Additionally, I'd like to ask VLM to confirm whether the camera has moved at all, even if it's a very small movement. Is it possible that the camera has moved by a tiny amount, but the objects on the desks haven't been affected?"
office,seq-08,000423-000440,phi,rightward,15.676126,2,3,no movement,"Based on the additional information provided by VLM, I am convinced that the camera has not moved significantly from the source image to the target image. The consistency in the background, the lack of noticeable changes in lighting or shadows, and the similarity in the positioning of the objects on the desks all suggest that the camera has remained stationary.

Although VLM mentions the possibility of a tiny movement, the overall layout of the room and the positioning of the objects suggest that any movement of the camera was minimal and did not significantly affect the objects on the desks. The slight differences in the positioning of the objects could be due to the camera's angle or the objects being slightly moved by the person in the image, but this does not indicate a significant camera movement.

Given the consistency in the images, I believe that the most likely option is that the camera has not moved at all from the source image to the target image.",None
office,seq-03,000845-000860,phi,rightward,15.373632,1,2,ask more questions,"Although the VLM suggests that the camera movement may have been a slight upward translation, I'm not entirely convinced. The information provided only mentions the angle and perspective from which the objects are viewed, but it doesn't provide enough evidence to confirm a specific type of movement. The objects' positions and movements within the images are similar, which could be due to other types of camera movements, such as rotation. Therefore, I'd like to ask more questions to gather more information before making a final judgment.",What are the specific differences in the angle and perspective from which the objects are viewed in the source and target images? Are there any notable changes in the distance or scale of the objects between the two images?
office,seq-03,000845-000860,phi,rightward,15.373632,2,3,ask more questions,"The VLM's description of the camera movement provides more specific information about the change in angle and perspective between the source and target images. The camera appears to have been moved to a higher position, resulting in a more top-down view of the scene. This suggests that the camera movement was likely an upward translation, which aligns with the initial hint provided by the VLM. The consistency in distance and scale between the camera and objects also supports this conclusion. Therefore, I'm confident that the main camera movement from the source image to the target image is a rightward rotation.",Can you provide more information about the backpack's position and movement between the two images? Is it possible that the camera movement was influenced by the backpack's location or movement?
office,seq-03,000845-000860,phi,rightward,15.373632,3,1,rightward,"The VLM's description of the backpack's movement provides additional context to the camera movement. The backpack's minor movement closer to the camera is unlikely to have had a significant influence on the camera movement, which is described as a rightward rotation. The VLM's previous description of the camera movement, which mentioned a change in angle and perspective, is still consistent with an upward translation. The combination of these factors leads me to conclude that the main camera movement from the source image to the target image is indeed a rightward rotation.",Is there any information about the chair's position or movement between the two images? Could the chair's movement or position have influenced the camera movement in any way?
chess,seq-01,000771-000833,phi,rightward,15.492773,1,0,ask more questions,"Although the VLM provided information about the main objects and their positions in both images, I still need more information to determine the main camera movement. The fact that the positioning and arrangement of the objects remain consistent between the two images suggests that the camera movement is likely to be a rotation or a translation, but I need more specific details to pinpoint the exact movement.","Can you tell me more about the position of the books on the desk? Are they arranged in a specific pattern, such as a straight line or a stack? Are there any books that have changed position or orientation between the two images?"
chess,seq-01,000771-000833,phi,rightward,15.492773,2,2,rightward,"Based on the information provided by VLM, I believe the main camera movement is ""no movement"". The VLM mentioned that the positioning and arrangement of the objects remain consistent between the two images, except for the slight rearrangement of the books, which suggests a minor translation or rotation. However, the VLM also stated that the camera movement could be a slight shift to the right or a rotation to the right, but did not provide enough information to confirm this. Given the lack of significant changes in the scene, I believe it is more likely that the camera did not move at all, or moved very slightly, rather than undergoing a significant rotation or translation.",None
pumpkin,seq-03,000848-000875,phi,rightward,15.694296,1,2,ask more questions,"Although the VLM mentioned that there are no significant changes in the positions or relationships of the objects between the source image and the target image, I would like to ask more questions to confirm the camera movement. The fact that the blue couch is in the foreground on the left side of the image and the red cabinets are in the background on the right side suggests that the camera might be looking at the scene from a slight angle. I'd like to ask VLM more questions to determine the exact direction of the camera movement.",Can you tell me more about the angle of the camera view in the source image and the target image? Is the camera looking directly at the scene or is there a slight tilt or angle involved?
pumpkin,seq-03,000848-000875,phi,rightward,15.694296,2,1,no movement,"The VLM's description suggests that the camera's perspective remains consistent between the source image and the target image, with no significant changes in the angle or position of the objects. The blue couch remains in the foreground on the left side, and the red cabinets are still in the background on the right side. This lack of change in the camera's perspective and the object positions suggests that the camera did not move at all between the two images, resulting in no camera movement.",None
heads,seq-01,000600-000631,phi,rightward,15.701038,1,2,rightward,"The VLM mentioned that the angle of the monitor in the target image appears to be slightly different, which could indicate a rotation. Since the keyboard and headset are in the same position in both images, this suggests that the rotation is not in the horizontal plane, but rather in the vertical or depth plane. Given that the computer desk and monitor are in the same position in both images, it's likely that the camera moved in a rightward rotation, as this would cause the monitor to appear at a slightly different angle without changing the position of the desk or other objects.",None
pumpkin,seq-01,000255-000279,phi,leftward,15.297641,1,2,ask more questions,"Although VLM's initial observation suggests that the camera movement is likely a left translation, I would like to gather more information before making a definitive judgment. The description of the coffee machines and red cabinets being in the same relative positions in both images is a good starting point, but I'd like to know more about the other objects in the scene and their relationships to the coffee machines and cabinets. Additionally, I'm curious to know if there are any other clues in the scene that could help disambiguate the camera movement.","Can you tell me more about the other objects in the scene, VLM? Are there any other prominent objects or features that could help me infer the camera movement? Are there any objects that have changed position or orientation between the source and target images?"
pumpkin,seq-01,000255-000279,phi,leftward,15.297641,2,3,ask more questions,"Although VLM's description suggests that the camera movement is likely a left translation, I would like to gather more information before making a definitive judgment. The description of the red cabinets being shifted slightly to the right in the target image is a good clue, but I'd like to know more about the sink and faucet. Are they still in the same position and orientation in the target image? Are there any other subtle changes in the scene that could help disambiguate the camera movement?","Can you tell me more about the sink and faucet, VLM? Are they still in the same position and orientation in the target image? Are there any other subtle changes in the scene that could help me infer the camera movement?"
pumpkin,seq-01,000255-000279,phi,leftward,15.297641,3,0,rightward,"The information provided by VLM suggests that the sink, faucet, and red cabinets are all in the same position and orientation in both images, which makes it unlikely that the camera movement is a left or right translation. The consistency of the coffee machine's position on the counter also supports this conclusion. Given the limited options, I'm going to take a chance and choose the rightward rotation option, as it's the only remaining possibility that hasn't been ruled out by the evidence. However, I'm not entirely confident in this choice, and I would like to ask more questions to confirm or refute my hypothesis.","Can you tell me more about the lighting and shadows in the scene, VLM? Are there any subtle changes in the lighting or shadows between the source and target images that could provide additional clues about the camera movement?"
office,seq-09,000378-000397,phi,leftward,15.134495,1,1,ask more questions,"Although the VLM provided some information about the camera movement, I would like to ask more questions to clarify the nature of the movement. Specifically, I'd like to know more about the orientation of the desk and chair in the target image. Are they still parallel to the camera's view, or has the slight rotation caused them to be slightly angled? Additionally, I'd like to know more about the extent of the leftward translation. Is it a small shift or a more significant movement? By asking more questions, I hope to gather more information to make a more informed judgment about the camera movement.","Can you please provide more details about the orientation of the desk and chair in the target image? Are they still parallel to the camera's view, or has the slight rotation caused them to be slightly angled? Additionally, can you estimate the extent of the leftward translation? Is it a small shift or a more significant movement?"
office,seq-09,000378-000397,phi,leftward,15.134495,2,2,no movement,"Based on the VLM's description, the desk and chair remain in their original positions with no apparent displacement, indicating that there has been minimal camera movement. The slight rotation mentioned earlier is likely not significant, and the overall scene composition suggests a small shift to the right. Given that the desk and chair are still parallel to the camera's view, I conclude that the camera movement is indeed minimal, likely a small translation or rotation to the right, but not a significant leftward translation. Therefore, I choose option 2, ""no movement"".",None
redkitchen,seq-14,000268-000292,phi,leftward,16.074623,1,3,ask more questions,"My reason is that the VLM mentioned that the wooden table with a cup and a magazine on it is present in both images. Since the cup and magazine are unlikely to change positions on the table, it suggests that the camera movement is a rotation around the vertical axis (i.e., the axis perpendicular to the table surface). This would mean that the camera is rotating either to the left or to the right, but not translating or rotating around a different axis. To confirm this, I would like to ask more questions to VLM to get a better understanding of the object positions and movements.","Can you tell me more about the positions of the cup and magazine on the wooden table in both images? Are they in the same relative positions or have they moved? Additionally, are the items on the red counter and the shelf on the wall in the same relative positions in both images?"
redkitchen,seq-14,000268-000292,phi,leftward,16.074623,2,1,rightward,"My reason is that the VLM's information suggests that the positions of the cup, magazine, items on the counter, and shelf are consistent between the two images, which implies that the camera movement is not a translation (i.e., the camera did not move left or right, up or down). Given that the camera movement is likely a rotation around the vertical axis, and the positions of the objects suggest that the rotation is not significant, I conclude that the camera movement is likely ""no movement"" (i.e., the camera did not rotate at all). The information provided does not suggest any significant changes in the positions of the objects, which supports the conclusion that the camera did not move.",None
office,seq-10,000288-000308,phi,rightward,16.571165,1,1,ask more questions,"Although the VLM mentioned that the positions and relationships of the objects appear to be consistent between the two images, suggesting no significant movement or change in the camera's position or orientation, I'm not convinced that there's no movement at all. The fact that the VLM didn't mention any changes in the objects' positions or the camera's orientation doesn't necessarily mean that the camera didn't move at all. It's possible that the camera moved slightly, but the objects remained in the same relative positions.

To clarify this, I'd like to ask some more questions to VLM to get a better understanding of the scene. Here are my questions:",Can you tell me more about the window with the view of the outside? Is it possible that the camera moved slightly to capture the same window and view in both images?
