scene,seq,pair,dof,label text,label value,round idx,pred option,pred text,reason,question
office,seq-09,000731-000738,phi,rightward,15.55459,1,0,ask more questions,"Although VLM has provided some useful information, I'm not convinced that the camera movement is solely a left translation. The positioning of the desk, chair, and bookshelf suggests that the camera may have moved left, but there could be other factors at play. For example, the camera might have rotated or translated in a different way. To gather more information, I'd like to ask VLM some follow-up questions to clarify the situation.","Can you please provide more details about the computer monitor? Is it positioned similarly in both images, and if so, what is its orientation (e.g., facing the camera, angled, etc.)? Additionally, are there any other objects in the scene that could provide clues about the camera movement?"
office,seq-09,000731-000738,phi,rightward,15.55459,2,1,ask more questions,"Although VLM's description of the computer monitor's position and orientation in both images provides some clues about the camera movement, I'm not convinced that the evidence points to a single, definitive answer. The monitor's shift from a slight angle to a more direct facing of the camera could suggest a left translation, but without more information, it's difficult to rule out other possibilities. Additionally, the fact that the monitor is positioned more centrally in the target image could also be due to other factors, such as a rotation or a change in the camera's distance from the scene. To gather more information, I'd like to ask VLM some follow-up questions to help clarify the situation.","Can you please provide more details about the bookshelf? Is it positioned similarly in both images, and if so, what is its orientation (e.g., facing the camera, angled, etc.)? Additionally, are there any other objects in the scene that could provide clues about the camera movement, such as any objects that might have changed position or orientation between the two images?"
office,seq-09,000731-000738,phi,rightward,15.55459,3,1,ask more questions,"Although VLM's description of the bookshelf's position and orientation in both images suggests a left translation, I'm not convinced that the evidence is conclusive. The bookshelf's similarity in both images could be due to other factors, such as a rotation or a change in the camera's distance from the scene. Additionally, the lack of clear visibility of the items on the bookshelf makes it difficult to rule out other possibilities. To gather more information, I'd like to ask VLM some follow-up questions to help clarify the situation.","Can you please provide more details about the desk and chair? Are they positioned similarly in both images, and if so, what is their orientation (e.g., facing the camera, angled, etc.)? Are there any other objects in the scene that could provide clues about the camera movement, such as any objects that might have changed position or orientation between the two images?"
office,seq-09,000731-000738,phi,rightward,15.55459,4,2,ask more questions,"Although VLM's description of the desk, chair, and bookshelf's positions in both images suggests a lack of significant movement, I'm not convinced that the evidence is conclusive. The angle of the target image makes it difficult to determine the exact orientation of the desk, chair, and bookshelf, which could be due to a rotation or a change in the camera's distance from the scene. Additionally, the fact that the bookshelf appears to be in a similar position in both images could be due to other factors, such as a translation or a change in the camera's perspective. To gather more information, I'd like to ask VLM some follow-up questions to help clarify the situation.","Can you please provide more details about the camera's angle and perspective in the target image? Is the camera looking at the scene from a similar angle as the source image, or is it looking at the scene from a different angle? Are there any other visual cues in the target image that could provide clues about the camera movement?"
office,seq-09,000731-000738,phi,rightward,15.55459,5,0,ask more questions,"Although VLM's description of the desk, chair, and bookshelf's positions in both images suggests a left translation, I'm not convinced that the evidence is conclusive. The angle of the target image makes it difficult to determine the exact orientation of the desk, chair, and bookshelf, which could be due to a rotation or a change in the camera's distance from the scene. Additionally, the fact that the bookshelf appears to be in a similar position in both images could be due to other factors, such as a translation or a change in the camera's perspective. To gather more information, I'd like to ask VLM some follow-up questions to help clarify the situation.","Can you please provide more details about the camera's angle and perspective in the target image? Is the camera looking at the scene from a similar angle as the source image, or is it looking at the scene from a different angle? Are there any other visual cues in the target image that could provide clues about the camera movement?"
office,seq-09,000731-000738,phi,rightward,15.55459,6,3,leftward,"Based on VLM's description of the camera's angle and perspective, as well as the positions of the desk, chair, and bookshelf, I believe that the main camera movement from the source image to the target image is a leftward rotation. The fact that the desk and chair appear to be in a similar position in both images, and that the bookshelf appears to be in a similar position as well, suggests that the camera has moved leftward while maintaining a similar angle and perspective. Additionally, the fact that the angle of the target image makes it difficult to determine the exact orientation of the objects could be due to a rotation rather than a translation.",None
office,seq-02,000123-000136,phi,rightward,15.059226,1,3,no movement,"My reason is that the VLM described the positions of the objects in both images as the same, with no mention of any changes in their relative positions. This suggests that the camera movement is minimal, and it's likely that the camera remained stationary or moved very slightly. The fact that the desk, chair, computer monitor, keyboard, mouse, notebook, pen, and fruits are all in the same position in both images supports this conclusion.",Can you tell me more about the lighting in both images? Is it the same or has it changed? Are there any shadows or reflections that could provide clues about the camera movement?
pumpkin,seq-01,000601-000644,phi,rightward,15.324047,1,2,ask more questions,"Although the VLM mentioned that the objects remain consistent in position and the camera's movement is limited to one of the six directions, it did not specify which direction. The information provided only states that there is no significant movement or change in the camera's position or orientation, but it does not rule out the possibility of a translation or rotation. Since the objects are stationary, it's possible that the camera moved in a way that didn't affect their relative positions. Therefore, I'd like to ask more questions to gather more information before making a judgment about the main camera movement.","Can you ask VLM to provide more details about the camera movement, such as whether the objects appear to be closer or farther away from the camera, or if there are any subtle changes in the lighting or shadows that could indicate a specific direction of movement?"
pumpkin,seq-01,000601-000644,phi,rightward,15.324047,2,1,no movement,"Based on the information provided by VLM, it seems that the camera did not move significantly closer or farther away from the objects, and the lighting conditions are consistent between the two images. Additionally, there are no subtle changes in the lighting or shadows that would suggest a specific direction of movement. Given that the objects remain in the same position relative to each other, it's reasonable to conclude that the camera did not move at all. The VLM's statement that it's difficult to determine the exact direction of the camera movement because the images don't provide enough information to rule out any of the six possible movements actually supports the conclusion that there was no movement.",None
pumpkin,seq-06,000849-000899,phi,leftward,42.632507,1,1,ask more questions,"Although the VLM mentioned that the microwave and coffee machine are both located on the countertop in both images, it doesn't provide any information about their relative positions or movements. Since the camera movement is limited to only six directions (three translations and three rotations), I want to gather more information to narrow down the possibilities. For example, I'd like to know if the microwave and coffee machine are in the same relative position in both images or if they've moved. Additionally, I'd like to know if any other objects in the scene have changed position or orientation. By asking more questions, I can gather more details about the scene and make a more informed judgment about the camera movement.","Hey VLM, can you tell me more about the relative positions of the microwave and coffee machine in the source and target images? Are they in the same position, or have they moved relative to each other? Are there any other objects in the scene that have changed position or orientation between the two images?"
pumpkin,seq-06,000849-000899,phi,leftward,42.632507,2,1,leftward,"The VLM's information suggests that the coffee machine has moved slightly closer to the camera, while the microwave has moved slightly further away from the camera. This implies that the camera has moved in a way that has changed the relative positions of the objects in the scene. The fact that the refrigerator and sink have also changed positions, with the refrigerator moving from left of the sink to right of the sink, and the sink moving from right of the refrigerator to left of the refrigerator, further supports this conclusion.

Given that the camera movement is limited to only six directions (three translations and three rotations), I infer that the camera has moved in a way that is consistent with a leftward rotation. This is because the coffee machine has moved closer to the camera, which suggests that the camera has rotated to the left to capture the scene. The changes in the positions of the refrigerator and sink also support this conclusion, as they would be expected to move in this way if the camera were rotating to the left.",None
pumpkin,seq-01,000331-000345,phi,leftward,15.587926,1,1,ask more questions,"Although VLM mentioned that the position and relationship of the objects remain consistent between the source and target images, indicating a rotation or slight translation, I'm not yet convinced that the camera movement is solely a rotation. The fact that the blue chair is positioned on the left side of the image in both images suggests that the camera might have moved slightly to the right. However, I'd like to gather more information to confirm this suspicion. Therefore, I'll ask more questions to VLM to get a better understanding of the camera movement.",Can you please tell me if the blue chair is still in the same position relative to the red cabinets and the kitchen counter in the target image compared to the source image? Are there any other objects in the scene that could provide clues about the camera movement?
pumpkin,seq-01,000331-000345,phi,leftward,15.587926,2,0,ask more questions,"Although VLM mentioned that the positioning of the blue chair and the red cabinets remains consistent, I'm still not convinced that the camera movement is solely a rotation or no movement. The fact that the blue chair is positioned on the left side of the kitchen counter in both images suggests that the camera might have moved slightly to the right. However, I'd like to gather more information to confirm this suspicion. VLM mentioned that without additional context or objects to compare, it's difficult to determine the exact nature of the camera movement. Therefore, I'll ask more questions to VLM to get a better understanding of the camera movement.","Can you please tell me if there are any other objects in the scene that could provide clues about the camera movement? For example, are there any objects that are partially occluded or have changed positions in the target image compared to the source image? Are there any other visual cues, such as shadows or reflections, that could help determine the camera movement?"
pumpkin,seq-01,000331-000345,phi,leftward,15.587926,3,2,no movement,"Although VLM mentioned that the positioning of the blue chair remains consistent, and there are no other objects that provide clues about the camera movement, I'm going to take a closer look at the fact that the blue chair is still on the left side of the kitchen counter in both images. This suggests to me that the camera might have moved slightly to the left, rather than to the right or not at all. The lack of other visual cues or changes in object positions makes it difficult to determine the exact nature of the camera movement, but based on the information provided, I'm leaning towards a leftward rotation.",None
pumpkin,seq-01,000683-000710,phi,rightward,15.240115,1,2,ask more questions,"Although the VLM provided information about the main objects and their positions, I still need more information to infer the camera movement. The description mentions that the red cabinet is located to the left of the sink, and the black appliance is placed on the countertop to the right of the sink. This suggests that the camera might have moved to capture the objects on the right side of the sink, but I'm not sure if it's a translation or a rotation. Additionally, the white dishwasher is situated below the countertop, which doesn't provide any direct information about the camera movement. Therefore, I need to ask more questions to clarify the movement.","Can you tell me if any objects have changed their position or orientation between the source and target images? For example, is the red cabinet still facing the same direction, or has it been rotated? Are there any objects that have moved closer or farther away from the camera?"
pumpkin,seq-01,000683-000710,phi,rightward,15.240115,2,2,rightward,"The VLM's description clearly indicates that the camera has moved to the right, capturing a different angle of the kitchen. The red cabinet and the black appliance have both moved to the right, which suggests a rightward movement. The fact that the white dishwasher has not changed its position or orientation further supports this conclusion. Therefore, I can confidently conclude that the main camera movement from the source image to the target image is a rightward rotation.",None
redkitchen,seq-04,000605-000628,phi,leftward,15.923716,1,2,ask more questions,"The VLM mentioned that the television screen shows a similar image of a person in both images, indicating that the camera movement is likely a rotation around the television screen. This suggests that the camera movement is not a translation, but rather a rotation. However, the VLM also mentioned that the positions and orientations of the red shelf and the sign appear to be slightly different, suggesting a minor translation or rotation of the camera. To determine the exact direction of the rotation, I would like to ask more questions to clarify the movement of these objects.","Can you tell me more about the position and orientation of the red shelf and the sign in the target image compared to the source image? Are they closer to or farther from the television screen, and are they rotated in the same direction as the television screen?"
redkitchen,seq-04,000605-000628,phi,leftward,15.923716,2,1,leftward,"The VLM's description of the camera movement is clear and consistent. The red shelf has moved from being directly in front of the television screen to being slightly to the left, which indicates a leftward translation of the camera. Additionally, the sign has rotated 90 degrees counterclockwise, which suggests that the camera has also rotated around the television screen in a leftward direction. The fact that the television screen's image of the person remains unchanged supports this conclusion, as it indicates that the camera's movement is indeed around the screen rather than directly translating the scene. Therefore, I conclude that the main camera movement from the source image to the target image is a leftward rotation.",None
office,seq-07,000333-000344,phi,rightward,16.143214,1,2,no movement,"The reason I chose option 2, ""no movement"", is that the VLM mentioned that the relative positions of the objects remain unchanged between the source and target images. Since the people seated at the desks on the left and right remain in the same positions, it suggests that the camera did not move at all. The VLM also mentioned that the camera movement is not discernible from the images provided, which further supports the idea that there was no movement. The consistency in the positioning of the objects across both images implies that the camera remained stationary, resulting in no movement from the source image to the target image.",None
office,seq-09,000666-000683,phi,rightward,15.889683,1,3,ask more questions,"Although the computer desk, monitor, and chair are in the same relative location in both images, the pair of shoes is located in front of the desk in both images. This suggests that the camera movement is not simply a translation, but rather a rotation. However, without more information, it's difficult to determine the direction of the rotation. Therefore, I would like to ask more questions to VLM to gather more information.","Can you tell me more about the position of the shoes in the source image and the target image? Are they aligned with the desk, or are they slightly offset? Are there any other objects in the scene that could provide additional clues about the camera movement?"
office,seq-09,000666-000683,phi,rightward,15.889683,2,2,ask more questions,"The position of the shoes in both images suggests that the camera movement involves a rotation around the desk. The fact that the shoes are still in front of the desk in both images implies that the rotation is around the vertical axis, rather than a translation or rotation around a different axis. However, the information provided by VLM does not allow us to determine the exact direction of the rotation. The shoes are slightly offset in the source image, which could indicate a leftward rotation, but the blurriness of the target image makes it difficult to determine the exact alignment and offset. Therefore, I would like to ask more questions to VLM to gather more information.","Can you tell me more about the blurriness in the target image? Is it due to a specific camera movement or a different factor, such as motion blur or depth of field? Are there any other objects in the scene that could provide additional clues about the camera movement?"
office,seq-09,000666-000683,phi,rightward,15.889683,3,0,rightward,"The information provided by VLM suggests that the camera movement is a rotation around the desk. The position of the desk, chair, and computer monitor remains consistent between the two images, indicating that the camera movement is limited to a rotation around the desk. The shoes are slightly offset in the source image, indicating a possible leftward rotation, but the blurriness in the target image makes it difficult to determine the exact direction of the rotation. However, the fact that the shoes appear to be slightly more centered in the target image suggests that the camera movement could be a rightward rotation. Given the consistency of the desk, chair, and carpet pattern, I believe that the main camera movement is no movement, meaning that the camera remained stationary and only rotated around the desk.",None
office,seq-03,000712-000729,phi,leftward,15.102795,1,3,leftward,"My reason is that the office chair in the source image is positioned in the foreground, slightly to the left, and appears to be facing towards the right side of the image. In the target image, the office chair is also positioned in the foreground but is slightly to the right and appears to be facing towards the left side of the image. This suggests a rotation movement from the source to the target image. Since the chair is facing in the opposite direction in the target image, I infer that the camera has rotated to the left. The positioning of the computer desks also supports this conclusion, as the desk in the source image is to the left of the chair, and the desk in the target image is to the right of the chair, which is consistent with a leftward rotation.",None
redkitchen,seq-12,000253-000270,phi,rightward,15.27082,1,3,rightward,"My reason is that the VLM mentioned that the positions of the countertop and the red drawer remain consistent between the two images, with the red drawer located to the right of the countertop in both images. This suggests that the camera movement is likely to be a translation along the horizontal axis, and since the objects are not rotated or flipped, it's more likely that the camera moved to the right rather than the left. The fact that the countertop and drawer are not rotated or flipped also rules out the possibility of a leftward rotation or any other type of movement besides a translation along the horizontal axis.",None
office,seq-08,000225-000244,phi,leftward,15.412968,1,2,ask more questions,"Although VLM provided some information about the camera movement, I'm not convinced that the movement is solely rightward and downward. The position and movement of the shoes suggest that the camera has moved slightly to the right, which is consistent with the information provided. However, the movement of the piece of clothing from the closet rod to the shelf is not explicitly described as a downward movement. Therefore, I would like to ask more questions to clarify the camera movement.","Can you please provide more information about the movement of the piece of clothing, such as the angle of the camera's view or the distance between the camera and the clothing in both images? Additionally, are there any other objects or features in the images that could help determine the camera movement?"
office,seq-08,000225-000244,phi,leftward,15.412968,2,1,rightward,"Based on the information provided by VLM, I believe the main camera movement from the source image to the target image is a rightward rotation. The position of the shoes suggests that the camera has moved slightly to the right, which is consistent with the movement of the piece of clothing from the closet rod to the shelf. The closet rod is on the left side of the image, and the shelf is on the right side, which implies that the camera has moved in a rightward direction to capture the piece of clothing on the shelf. Additionally, the distance between the camera and the piece of clothing is relatively short, which suggests that the camera movement is not a large or dramatic one. Overall, the combination of the shoe and clothing movements suggests a rightward rotation of the camera.

No further questions are needed at this point, as the information provided by VLM seems sufficient to make a confident judgment about the camera movement.",None
office,seq-08,000168-000187,phi,leftward,15.638572,1,3,rightward,"My reason is that the VLM mentioned that the chair is positioned in front of the desk, facing the computer monitor in the source image, and in the target image, the chair is positioned to the right of the desk, facing the computer monitor. This suggests that the camera has rotated around the desk, and the chair has moved from being in front of the desk to being to the right of the desk. Additionally, the trash can has also moved from being to the left of the desk to being to the right of the desk, which further supports the idea of a right rotation around the desk.","Can you please confirm if the desk itself has moved or remained stationary during the camera movement? Additionally, are there any other objects that have changed positions or orientations during the camera movement?"
office,seq-03,000729-000752,phi,leftward,15.209957,1,2,ask more questions,"Based on the information provided, I don't have enough information to determine the main camera movement from the source image to the target image. The objects mentioned are mostly static and don't provide any clear indication of the camera movement. The desk, chair, backpack, and trash bin are all in fixed positions, and the computer monitor, keyboard, and mouse are also stationary. I would like to ask more questions to VLM to gather more information about the images before making a judgment about the camera movement.","Can you tell me more about the background in the source image, VLM? Is it a plain wall, a window, or something else? Are there any other objects or features that could provide clues about the camera movement?"
